{
  "$schema": "https://raw.githubusercontent.com/csilost2001/html-designer/main/schemas/conventions.schema.json",
  "version": "1.0.0",
  "description": "処理フロー仕様書 / ProcessFlow から @conv.* で参照される横断規約カタログ。docs/conventions/validation-rules.md の構造化版",
  "updatedAt": "2026-04-20T00:00:00.000Z",

  "msg": {
    "required": {
      "template": "{label}は必須入力です",
      "params": ["label"],
      "description": "非空必須エラーの既定メッセージ"
    },
    "maxLength": {
      "template": "{label}は{max}文字以内で入力してください",
      "params": ["label", "max"]
    },
    "invalidFormat": {
      "template": "{label}の形式が正しくありません",
      "params": ["label"]
    },
    "duplicate": {
      "template": "この{label}は既に登録されています",
      "params": ["label"]
    },
    "outOfRange": {
      "template": "{label}は{min}〜{max}の範囲で入力してください",
      "params": ["label", "min", "max"]
    },
    "mustBePositive": {
      "template": "{label}は1以上の数値を入力してください",
      "params": ["label"]
    }
  },

  "regex": {
    "email-simple": {
      "pattern": "^[^\\s@]+@[^\\s@]+\\.[^\\s@]+$",
      "description": "メールアドレス (RFC5322 簡易)",
      "exampleValid": ["a@b.jp", "user@example.com"],
      "exampleInvalid": ["a@b", "no-at-sign"]
    },
    "phone-jp": {
      "pattern": "^0\\d{1,4}-\\d{1,4}-\\d{4}$",
      "description": "国内電話番号 (固定/携帯、ハイフン必須)",
      "exampleValid": ["080-1234-5678", "03-1234-5678"],
      "exampleInvalid": ["+81-80-1234-5678", "08012345678"]
    },
    "postal-jp": {
      "pattern": "^\\d{3}-?\\d{4}$",
      "description": "日本の郵便番号 (ハイフン任意、保存時は NNN-NNNN 正規化)",
      "exampleValid": ["100-0001", "1000001"],
      "exampleInvalid": ["10-00001"]
    },
    "kana-fullwidth": {
      "pattern": "^[\\u30A0-\\u30FF ー・]+$",
      "description": "全角カタカナ (長音符・中黒・半角空白許容)",
      "exampleValid": ["ヤマダ タロウ", "オオノ・ケンイチ"],
      "exampleInvalid": ["やまだ", "YAMADA"]
    },
    "alnum": {
      "pattern": "^[A-Za-z0-9]+$",
      "description": "英数字のみ",
      "exampleValid": ["Abc123"],
      "exampleInvalid": ["あいう", "A-1"]
    }
  },

  "limit": {
    "nameMax": { "value": 100, "unit": "char", "description": "氏名最大長 (customers.name 等)" },
    "nameKanaMax": { "value": 100, "unit": "char" },
    "emailMax": { "value": 255, "unit": "char", "description": "RFC5321 準拠" },
    "phoneMax": { "value": 20, "unit": "char" },
    "postalMax": { "value": 10, "unit": "char", "description": "NNN-NNNN 正規化後は 8 文字" },
    "addressMax": { "value": 500, "unit": "char" },
    "companyNameMax": { "value": 200, "unit": "char" },
    "quantityMax": { "value": 9999, "unit": "integer", "description": "発注可能数量の上限" },
    "quantityMin": { "value": 1, "unit": "integer" },
    "amountMax": { "value": 999999999999, "unit": "yen", "description": "DECIMAL(12,0) の上限、JPY" }
  }
}
